ChannelName,ContentCategory,TopPerformingTopics,PostingFrequency,Notes
Finance Education Creator A,Wealth Building,SIP discipline; compounding basics; money habits,5-7 shorts per week,"Track education formats only. Do not copy scripts, claims, or recommendations."
Market Basics Channel B,Market Vocabulary,PE ratio; market cap; IPO basics,3-5 shorts per week,"Observe topic packaging, not stock opinions."
Risk First Trading Educator C,Trading Basics,Stop loss; position sizing; trade journal,4-6 shorts per week,Keep UNLOAN content beginner-friendly and non-advisory.
Investor Psychology Creator D,Behavioral Finance,FOMO; panic selling; overtrading,2-4 shorts per week,"Use as signal for education gaps, not engagement automation."
Platform Tools Explainer E,Investor Toolkit,GTT orders; limit orders; trailing stop loss,3-5 shorts per week,Avoid broker endorsement or platform claims.
